{
  "address": "example_address",
  "email": "example_email",
  "firstName": "example_firstName",
  "homePhone": "example_homePhone",
  "id": 1,
  "lastName": "example_lastName",
  "mobilePhone": "example_mobilePhone",
  "otherPhone": "example_otherPhone",
  "percentageOwnership": 1.0,
  "workPhone": "example_workPhone"
}